{
  "version": 1,
  "storyline": {
    "id": "sales_elevator",
    "name": "Sales Elevator, Innov8 Elevators"
  },
  "lens": {
    "id": "readiness_based",
    "styles": [
      "D",
      "G",
      "P",
      "E"
    ]
  },
  "participants": 300,
  "completed": 267,
  "completeAt": 100,
  "completion": {
    "average": 94.3,
    "buckets": [
      {
        "key": "upTo50",
        "count": 20,
        "share": 6.67
      },
      {
        "key": "to80",
        "count": 9,
        "share": 3
      },
      {
        "key": "to100",
        "count": 4,
        "share": 1.33
      },
      {
        "key": "full",
        "count": 267,
        "share": 89
      }
    ]
  },
  "skills": [
    {
      "key": "situational_flexibility",
      "reportOnly": false,
      "rated": 234,
      "score": 58.62,
      "levels": [
        36,
        132,
        0,
        66
      ],
      "unrated": 33
    },
    {
      "key": "coaching_for_growth",
      "reportOnly": false,
      "rated": 233,
      "score": 61.21,
      "levels": [
        42,
        47,
        127,
        15,
        2
      ],
      "unrated": 34
    },
    {
      "key": "difficult_conversations",
      "reportOnly": false,
      "rated": 233,
      "score": 85.07,
      "levels": [
        0,
        0,
        82,
        51,
        100
      ],
      "unrated": 34
    },
    {
      "key": "goal_setting",
      "reportOnly": false,
      "rated": 229,
      "score": 70.51,
      "levels": [
        0,
        8,
        217,
        4
      ],
      "unrated": 38
    },
    {
      "key": "giving_feedback",
      "reportOnly": false,
      "rated": 134,
      "score": 66.94,
      "levels": [
        0,
        6,
        128
      ],
      "unrated": 133
    },
    {
      "key": "recognition_fairness",
      "reportOnly": false,
      "rated": 134,
      "score": 46.57,
      "levels": [
        42,
        83,
        9
      ],
      "unrated": 133
    },
    {
      "key": "communicating_change",
      "reportOnly": false,
      "rated": 131,
      "score": 45.56,
      "levels": [
        52,
        60,
        19
      ],
      "unrated": 136
    },
    {
      "key": "results_ownership",
      "reportOnly": false,
      "rated": 209,
      "score": 68.57,
      "levels": [
        69,
        39,
        1,
        0,
        100
      ],
      "unrated": 58
    }
  ],
  "overall": {
    "rated": 234,
    "score": 64.34,
    "levels": [
      0,
      168,
      0,
      66
    ],
    "unrated": 33,
    "capped": {
      "count": 50,
      "gates": {
        "fit": 50,
        "people": 46,
        "business": 36
      }
    }
  },
  "objectives": {
    "target": 240000,
    "revenue": 171266.34,
    "conversions": 5.15,
    "share": 71.36,
    "beatTarget": 70,
    "team": {
      "skill": {
        "start": 56,
        "end": 65.92
      },
      "morale": {
        "start": 54,
        "end": 34.78
      },
      "result": {
        "start": 59,
        "end": 54.51
      },
      "trust": {
        "start": 50,
        "end": 55.76
      }
    }
  },
  "styles": {
    "adaptability": 41.8,
    "preferred": {
      "D": 97.83,
      "G": 95.83,
      "P": 15.5,
      "E": 57.83
    },
    "perStyle": [
      {
        "key": "D",
        "count": 6598,
        "fitted": 4762,
        "needed": 10167,
        "proportion": 29.4,
        "accuracy": 72.17,
        "neededShare": 45.31
      },
      {
        "key": "G",
        "count": 4284,
        "fitted": 832,
        "needed": 1797,
        "proportion": 19.09,
        "accuracy": 19.42,
        "neededShare": 8.01
      },
      {
        "key": "P",
        "count": 4887,
        "fitted": 3162,
        "needed": 8472,
        "proportion": 21.78,
        "accuracy": 64.7,
        "neededShare": 37.76
      },
      {
        "key": "E",
        "count": 6670,
        "fitted": 1194,
        "needed": 2003,
        "proportion": 29.73,
        "accuracy": 17.9,
        "neededShare": 8.93
      }
    ]
  },
  "consistency": {
    "neededUsed": 63,
    "intendedUsed": 42.64,
    "neededIntended": 57.34
  },
  "funnel": [
    {
      "period": 1,
      "runs": 267,
      "stages": [
        {
          "stage": "leads",
          "actual": 65.16,
          "ideal": 84.56
        },
        {
          "stage": "qualify",
          "actual": 23.38,
          "ideal": 34.95
        },
        {
          "stage": "proposal",
          "actual": 5.54,
          "ideal": 8.67
        },
        {
          "stage": "negotiation",
          "actual": 1.95,
          "ideal": 3.58
        },
        {
          "stage": "conversion",
          "actual": 0.78,
          "ideal": 1.48
        }
      ]
    },
    {
      "period": 2,
      "runs": 267,
      "stages": [
        {
          "stage": "leads",
          "actual": 63.83,
          "ideal": 84.56
        },
        {
          "stage": "qualify",
          "actual": 22.33,
          "ideal": 34.95
        },
        {
          "stage": "proposal",
          "actual": 5.07,
          "ideal": 8.67
        },
        {
          "stage": "negotiation",
          "actual": 1.68,
          "ideal": 3.58
        },
        {
          "stage": "conversion",
          "actual": 0.65,
          "ideal": 1.48
        }
      ]
    },
    {
      "period": 3,
      "runs": 267,
      "stages": [
        {
          "stage": "leads",
          "actual": 63.32,
          "ideal": 84.56
        },
        {
          "stage": "qualify",
          "actual": 21.08,
          "ideal": 34.95
        },
        {
          "stage": "proposal",
          "actual": 4.15,
          "ideal": 8.67
        },
        {
          "stage": "negotiation",
          "actual": 1.69,
          "ideal": 3.58
        },
        {
          "stage": "conversion",
          "actual": 0.63,
          "ideal": 1.48
        }
      ]
    },
    {
      "period": 4,
      "runs": 267,
      "stages": [
        {
          "stage": "leads",
          "actual": 64.22,
          "ideal": 84.56
        },
        {
          "stage": "qualify",
          "actual": 21.99,
          "ideal": 34.95
        },
        {
          "stage": "proposal",
          "actual": 4.76,
          "ideal": 8.67
        },
        {
          "stage": "negotiation",
          "actual": 2,
          "ideal": 3.58
        },
        {
          "stage": "conversion",
          "actual": 0.75,
          "ideal": 1.48
        }
      ]
    },
    {
      "period": 5,
      "runs": 267,
      "stages": [
        {
          "stage": "leads",
          "actual": 66.37,
          "ideal": 84.56
        },
        {
          "stage": "qualify",
          "actual": 23.18,
          "ideal": 34.95
        },
        {
          "stage": "proposal",
          "actual": 5.07,
          "ideal": 8.67
        },
        {
          "stage": "negotiation",
          "actual": 2.16,
          "ideal": 3.58
        },
        {
          "stage": "conversion",
          "actual": 0.82,
          "ideal": 1.48
        }
      ]
    },
    {
      "period": 6,
      "runs": 267,
      "stages": [
        {
          "stage": "leads",
          "actual": 66.47,
          "ideal": 84.56
        },
        {
          "stage": "qualify",
          "actual": 22.74,
          "ideal": 34.95
        },
        {
          "stage": "proposal",
          "actual": 4.84,
          "ideal": 8.67
        },
        {
          "stage": "negotiation",
          "actual": 2.03,
          "ideal": 3.58
        },
        {
          "stage": "conversion",
          "actual": 0.76,
          "ideal": 1.48
        }
      ]
    },
    {
      "period": 7,
      "runs": 267,
      "stages": [
        {
          "stage": "leads",
          "actual": 64.64,
          "ideal": 84.56
        },
        {
          "stage": "qualify",
          "actual": 21.69,
          "ideal": 34.95
        },
        {
          "stage": "proposal",
          "actual": 4.46,
          "ideal": 8.67
        },
        {
          "stage": "negotiation",
          "actual": 1.82,
          "ideal": 3.58
        },
        {
          "stage": "conversion",
          "actual": 0.67,
          "ideal": 1.48
        }
      ]
    },
    {
      "period": 8,
      "runs": 267,
      "stages": [
        {
          "stage": "leads",
          "actual": 64.03,
          "ideal": 84.56
        },
        {
          "stage": "qualify",
          "actual": 21.43,
          "ideal": 34.95
        },
        {
          "stage": "proposal",
          "actual": 4.34,
          "ideal": 8.67
        },
        {
          "stage": "negotiation",
          "actual": 1.76,
          "ideal": 3.58
        },
        {
          "stage": "conversion",
          "actual": 0.65,
          "ideal": 1.48
        }
      ]
    }
  ],
  "actions": [
    {
      "key": "meet",
      "frequency": 0.83,
      "used": 126,
      "reached": 1880,
      "mean": 4.22
    },
    {
      "key": "energize",
      "frequency": 2.36,
      "used": 134,
      "reached": 5220,
      "mean": 1.58
    },
    {
      "key": "email",
      "frequency": 1.24,
      "used": 126,
      "reached": 330,
      "mean": 0.52
    },
    {
      "key": "training",
      "frequency": 2.7,
      "used": 134,
      "reached": 721,
      "mean": 5.74
    },
    {
      "key": "swap",
      "frequency": 0,
      "used": 0,
      "reached": 0,
      "mean": null
    },
    {
      "key": "hire",
      "frequency": 0,
      "used": 0,
      "reached": 0,
      "mean": null
    },
    {
      "key": "fire",
      "frequency": 0,
      "used": 0,
      "reached": 0,
      "mean": null
    },
    {
      "key": "f2f",
      "frequency": 2.34,
      "used": 188,
      "reached": 626,
      "mean": 6.12
    },
    {
      "key": "assess",
      "frequency": 0,
      "used": 0,
      "reached": 0,
      "mean": null
    },
    {
      "key": "reward",
      "frequency": 1.07,